{
  "$schema": "https://json-schema.org/draft/2020-12/schema",
  "title": "Channel record",
  "description": "One file per channel at data/channels/<handle>.json. Produced by src/pull.py. This is a contract: do not change a field name without telling the team.",
  "type": "object",
  "required": ["handle", "channel_id", "title", "subscribers", "pulled_at", "videos"],
  "properties": {
    "handle": { "type": "string", "description": "YouTube handle including the @" },
    "channel_id": { "type": "string" },
    "title": { "type": "string" },
    "description": { "type": "string" },
    "subscribers": { "type": "integer" },
    "uploads_playlist_id": { "type": "string" },
    "pulled_at": { "type": "string", "format": "date-time" },
    "videos": {
      "type": "array",
      "description": "Most recent uploads, newest first, normally 15",
      "items": {
        "type": "object",
        "required": ["video_id", "title", "published_at", "views", "likes", "comments"],
        "properties": {
          "video_id": { "type": "string" },
          "title": { "type": "string" },
          "description": { "type": "string" },
          "published_at": { "type": "string", "format": "date-time" },
          "duration_seconds": { "type": "integer" },
          "views": { "type": ["integer", "null"] },
          "likes": { "type": ["integer", "null"] },
          "comments": { "type": ["integer", "null"] },
          "url": { "type": "string" }
        }
      }
    },
    "discovery": {
      "type": "object",
      "description": "Why this channel is a candidate. Present only when it came from a discover.py run rather than handles.txt. Optional: a hand-listed channel has no discovery evidence and is not less valid for it.",
      "properties": {
        "matches": {
          "type": "array",
          "description": "Each search query that surfaced this channel, with the video that matched",
          "items": {
            "type": "object",
            "required": ["query", "video_id"],
            "properties": {
              "query": { "type": "string" },
              "video_id": { "type": "string" },
              "video_title": { "type": "string" },
              "rank": { "type": "integer", "minimum": 1 }
            }
          }
        }
      }
    },
    "comment_records": {
      "type": "array",
      "items": {
        "type": "object",
        "required": ["comment_id", "video_id", "text"],
        "properties": {
          "comment_id": {"type": "string"},
          "video_id": {"type": "string"},
          "text": {"type": "string"}
        }
      }
    },
    "sampled_comments": {
      "type": "array",
      "description": "Top-level comment text sampled from the three highest-view videos",
      "items": { "type": "string" }
    }
  }
}
