{
    "handle": "@overclaiming-channel",
    "channel_id": "UCbanned0001",
    "title": "Overclaiming Productivity Channel",
    "description": "Bold promises about creative tools.",
    "subscribers": 40000,
    "pulled_at": "2026-09-01T00:00:00Z",
    "videos": [
        {
            "video_id": "ban001",
            "title": "How Milanote Guarantees Explosive Audience Growth",
            "description": "This board format guarantees creative career growth for anyone who uses it.",
            "published_at": "2026-08-15T00:00:00Z",
            "views": 20000,
            "likes": 1000,
            "comments": 90
        }
    ],
    "sampled_comments": [
        "wow this really works",
        "my career changed after watching this"
    ]
}